Player,Years,Total,Team,Breakdown,Order,,,Players Available
,,,,,,,,"Aaron Sanchez, SP TOR"
,,,,,,,,"Addison Russell, SS CHC"
,,,,,,,,"Carlos Rodon, SP CWS"
,,,,,,,,"Christian Yelich, OF Mil"
,,,,,,,,"Devon Travis, 2B TOR"
,,,,,,,,"Garrett Richards, SP SD"
,,,,,,,,"Gregory Polanco, OF PIT"
,,,,,,,,"Jacob DeGrom, SP NYM"
,,,,,,,,"Jimmy Nelson, SP Mil"
,,,,,,,,"Joe Panik, 2B SF"
,,,,,,,,"Jorge Soler, OF KC"
,,,,,,,,"Kevin Gausman, SP ATL"
,,,,,,,,"Kevin Pillar, OF TOR"
,,,,,,,,"Nick Castellanos, 3B DET"
,,,,,,,,"Rougned Odor, 2B TEX"
,,,,,,,,"Steven Matz, SP NYM"
,,,,,,,,"Travis Shaw, 3B MIL"
,,,,,,,,"Trevor Bauer, SP CLE"
,,,,,,,,"Tyler Skaggs, SP LAA"
,,,,,,,,"Vince Velasquez, SP PHI"
,,,,,,,,"Xander Bogaerts, SS BOS"
,,,,,,,,"Yasmani Grandal, C LAD"
